{
  "schema_version": "clawgs.v2",
  "source": {
    "tool": "claude",
    "path": "tests/fixtures/claude-sample.jsonl",
    "discovered": false,
    "cwd": "/schema-sync/project"
  },
  "snapshot": {
    "user_task": "Summarize logs",
    "current_tool": {
      "tool": "read_file",
      "detail": "demo.txt",
      "kind": "tool_use"
    },
    "token_count": 88,
    "recent_actions": [
      {
        "tool": "read_file",
        "detail": "demo.txt",
        "kind": "tool_use"
      },
      {
        "tool": "said",
        "detail": "I read the file",
        "kind": "text"
      }
    ]
  },
  "stats": {
    "events_seen": 2,
    "malformed_lines_skipped": 0,
    "bytes_read": 279
  },
  "generated_at": "<generated_at>"
}
